cbsa_code,cbsa_name,cbsa_type,centroid_lat,centroid_lon,station_id,station_name,station_distance_km,avg_annual_temp,jan_avg_temp,jul_avg_temp,annual_precipitation,annual_snowfall,n_months_available,has_complete_year,temp_seasonality,snow_binary
33420,"Mineral Wells, TX Micro Area",2,32.752204,-98.317967,USW00093985,"MINERAL WELLS AP, TX US",24.31449413,65.7139726,45.3,84.5,32.02,,12,TRUE,39.2,0
33460,"Minneapolis-St. Paul-Bloomington, MN-WI Metro Area",1,45.096664,-93.275361,USW00094960,"MPLS CRYSTAL AP, MN US",7.073074944,46.31287671,16.4,74.2,30.03,,12,TRUE,57.8,0
33620,"Moberly, MO Micro Area",2,39.439249,-92.492959,USC00235671,"MOBERLY, MO US",5.296566161,54.61178082,28.7,77.3,44.95,16.7,12,TRUE,48.6,1
33660,"Mobile, AL Metro Area",1,30.684572,-88.196568,USW00013894,"MOBILE, AL US",4.164578008,68.03424658,51.1,82,65.74,0.2,12,TRUE,30.9,1
33700,"Modesto, CA Metro Area",1,37.562316,-121.002831,USW00023258,"MODESTO CITY CO AP, CA US",8.278184998,63.5030137,47.9,79.7,10.92,,12,TRUE,31.8,0
33740,"Monroe, LA Metro Area",1,32.67396,-92.058318,USW00013942,"MONROE RGNL AP, LA US",17.68691113,66.2260274,47,83,56.74,,12,TRUE,36,0
33780,"Monroe, MI Metro Area",1,41.916097,-83.487106,USC00202308,"DUNDEE, MI US",14.07523658,49.86027397,25.3,73.3,36.17,,12,TRUE,48,0
33860,"Montgomery, AL Metro Area",1,32.365631,-86.404585,USW00013895,"MONTGOMERY AP, AL US",7.336316835,66.99315068,48.2,83.1,51.35,,12,TRUE,34.9,0
33900,"Monticello, IN Micro Area",2,40.75095,-86.864293,USC00121417,"CHALMERS 5 W, IN US",12.21315655,50.26630137,24.2,72.4,42.59,23.1,12,TRUE,48.2,1
33910,"Monticello, NY Micro Area",2,41.719993,-74.771577,USC00304731,"LIBERTY 1 NE, NY US",9.455399156,45.77342466,22.3,68.9,55.54,,12,TRUE,46.6,0
33980,"Morehead City, NC Micro Area",2,34.858343,-76.53586,USW00093765,"BEAUFORT MICHAEL J SMITH FLD, NC US",17.94819698,64.25150685,46.4,80.5,56.63,,12,TRUE,34.1,0
34100,"Morristown, TN Metro Area",1,36.115484,-83.376546,USC00406272,"MORRISTOWN WFO, TN US",6.328396947,58.77808219,37.6,76.8,48.72,9.1,12,TRUE,39.2,1
34140,"Moscow, ID Micro Area",2,46.81892,-116.730974,USC00107301,"POTLATCH 3 NNE, ID US",18.32951218,47.17068493,31.3,66.8,22.92,,12,TRUE,35.5,0
34180,"Moses Lake, WA Micro Area",2,47.213633,-119.467788,USW00024141,"EPHRATA MUNI AP, WA US",11.06776005,51.7339726,29.8,76.2,7.09,,12,TRUE,46.4,0
34300,"Mountain Home, ID Micro Area",2,43.394698,-115.471205,USC00101018,"BOISE LUCKY PEAK DAM, ID US",49.24429024,52.42109589,31.2,76.8,15.42,,12,TRUE,45.6,0
34340,"Mount Airy, NC Micro Area",2,36.415416,-80.686463,USC00315890,"MT AIRY 2 W, NC US",9.480556786,56.04520548,35.9,74.9,53.43,,12,TRUE,39,0
34380,"Mount Pleasant, MI Micro Area",2,43.645233,-84.839424,USC00205662,"CENTRAL MICHIGAN UNIV, MI US",8.686320573,48.05616438,23.3,72.8,37.97,,12,TRUE,49.5,0
34460,"Mount Sterling, KY Micro Area",2,38.039616,-83.747734,USC00155640,"MT STERLING, KY US",16.3812498,54.15315068,31.9,74.7,53.55,,12,TRUE,42.8,0
34540,"Mount Vernon, OH Micro Area",2,40.40362,-82.422393,USC00332044,"DANVILLE 2 W, OH US",10.7469276,49.58273973,26,70.8,43.82,,12,TRUE,44.8,0
34580,"Mount Vernon-Anacortes, WA Metro Area",1,48.493292,-121.81577,USC00451679,"CONCRETE PPL FISH STN, WA US",7.482871915,50.61643836,37.9,64.6,72.68,,12,TRUE,26.7,0
34620,"Muncie, IN Metro Area",1,40.227543,-85.399262,USW00094895,"MUNCIE DELAWARE CO AP, IN US",0.882589854,54.04191781,29.2,75.8,40.89,,12,TRUE,46.6,0
34680,"Murrells Inlet, SC Micro Area",2,33.417531,-79.296333,USC00383470,"GEORGETOWN CO AP, SC US",11.45643716,65.70109589,48.1,81.9,54.99,,12,TRUE,33.8,0
34700,"Muscatine, IA Micro Area",2,41.483776,-91.118699,USC00135844,"MUSCATINE 2N, IA US",6.178366881,50.40739726,22.6,74.6,41.23,32.1,12,TRUE,52,1
34740,"Muskegon-Norton Shores, MI Metro Area",1,43.428739,-86.420908,USC00205567,"MONTAGUE 4 NW, MI US",3.642149318,47.45205479,25.3,69.3,40.05,,12,TRUE,44,0
34780,"Muskogee, OK Micro Area",2,35.617551,-95.383911,USW00093953,"MUSKOGEE DAVIS FLD, OK US",4.805067521,61.23452055,39.2,81.9,44.83,,12,TRUE,42.7,0
34820,"Myrtle Beach-Conway-North Myrtle Beach, SC Metro Area",1,33.909269,-78.976675,USW00093718,"N MYRTLE BCH AP, SC US",25.7385167,64.55150685,46.8,80.7,49.24,,12,TRUE,33.9,0
34900,"Napa, CA Metro Area",1,38.5071,-122.325904,USC00040212,"ANGWIN PACIFIC UNION COLLEGE, CA US",12.3842794,57.83232877,47.4,69.7,35.61,,12,TRUE,22.3,0
34940,"Naples-Marco Island, FL Metro Area",1,26.118786,-81.400955,USW00092826,"EVERGLADES CITY 5 NE, FL US",25.7235279,76.02328767,65.2,83.7,54.5,,12,TRUE,18.5,0
34980,"Nashville-Davidson--Murfreesboro--Franklin, TN Metro Area",1,36.091577,-86.72298,USW00013897,"NASHVILLE INTL AP, TN US",4.294209216,61.28136986,39.6,80.8,51.45,3.9,12,TRUE,41.2,1
35100,"New Bern, NC Micro Area",2,35.116829,-77.08132,USW00093719,"NEW BERN CRAVEN CO AP, NC US",6.233549413,63.16219178,44.5,80.4,54.24,,12,TRUE,35.9,0
35140,"Newberry, SC Micro Area",2,34.289881,-81.599676,USC00386209,"NEWBERRY, SC US",1.951134652,62.42109589,42.8,80.5,46.77,,12,TRUE,37.7,0
35220,"New Castle, IN Micro Area",2,39.929591,-85.397363,USC00126164,"NEW CASTLE 3 SW, IN US",3.939236701,50.80136986,26,72.2,46.7,24.9,12,TRUE,46.2,1
35300,"New Haven, CT Metro Area",1,41.290167,-72.837024,USW00014758,"NEW HAVEN TWEED AP, CT US",5.110017378,53.09342466,31.5,75.5,41.32,,12,TRUE,44,0
35340,"New Iberia, LA Micro Area",2,29.606013,-91.842706,USC00163313,"FRANKLIN 3 NW, LA US",37.6138651,69.1860274,53.1,82,66.11,,12,TRUE,28.9,0
35380,"New Orleans-Metairie, LA Metro Area",1,29.282447,-89.576068,USW00012884,"BOOTHVILLE ASOS, LA US",17.28799343,70.84986301,55,83.3,53.18,,12,TRUE,28.3,0
35420,"New Philadelphia-Dover, OH Micro Area",2,40.447439,-81.471166,USW00004852,"NEW PHILADELPHIA FLD, OH US",4.857257454,52.32164384,29,73.6,39.62,,12,TRUE,44.6,0
35460,"Newport, TN Micro Area",2,35.916198,-83.119224,USC00406534,"NEWPORT 1 NW, TN US",10.46873598,59.15945205,38.3,77.7,46.81,3.8,12,TRUE,39.4,1
35580,"New Ulm, MN Micro Area",2,44.246541,-94.733647,USC00215888,"NEW ULM 3SE, MN US",26.44558327,44.61643836,14.2,71.7,34.21,,12,TRUE,57.5,0
35620,"New York-Newark-Jersey City, NY-NJ Metro Area",1,40.735425,-73.80773,USW00014732,"NEW YORK LAGUARDIA AP, NY US",7.827644525,57.46082192,35.2,80.1,46.97,29.8,12,TRUE,44.9,1
35660,"Niles, MI Metro Area",1,41.791382,-86.742543,USC00124837,"LAPORTE, IN US",20.00818418,50.24849315,24.5,73.3,44.55,69.7,12,TRUE,48.8,1
35700,"Nogales, AZ Micro Area",2,31.525733,-110.845228,USW00003196,"NOGALES INTL AP, AZ US",11.66815945,65.29835616,49.9,80.9,14.95,,12,TRUE,31,0
35840,"North Port-Bradenton-Sarasota, FL Metro Area",1,27.329055,-82.414533,USC00086065,"MYAKKA RVR SP, FL US",13.93656187,74.14438356,62.5,82.9,60.06,,12,TRUE,20.4,0
35940,"Norwalk, OH Micro Area",2,41.14508,-82.594641,USC00336118,"NORWALK WWTP, OH US",13.64887436,51.10849315,26.7,74.1,41.32,31.4,12,TRUE,47.4,1
35980,"Norwich-New London-Willimantic, CT Metro Area",1,41.484769,-72.101666,USC00065910,"NORWICH PUBLIC UTILITY PLT, CT US",5.559648917,52.42547945,30.3,75.4,51.65,,12,TRUE,45.1,0
36020,"Oak Harbor, WA Micro Area",2,48.158554,-122.670649,USC00451783,"COUPEVILLE 1 S, WA US",5.623727505,50.32739726,40.4,61.4,22.31,,12,TRUE,21,0
36180,"Ocean Pines, MD Micro Area",2,38.222133,-75.309931,USC00188380,"SNOW HILL 4 N, MD US",5.877016998,59.96273973,39.7,80,47.44,,12,TRUE,40.3,0
36220,"Odessa, TX Metro Area",1,31.865301,-102.542507,USW00003031,"ODESSA SCHLEMEYER FLD, TX US",15.94303352,65.35013699,45,83.4,13.35,,12,TRUE,38.4,0
36260,"Ogden, UT Metro Area",1,41.124342,-111.866933,USC00429346,"WEBER BASIN PUMP PLT 3, UT US",4.172039272,50.78383562,27.4,77.5,26.1,,12,TRUE,50.1,0
36380,"Okeechobee, FL Micro Area",2,27.385592,-80.887388,USC00084621,"KISSIMMEE PRAIRIE PRESERVE, FL US",29.26479744,73.23945205,61.7,82.1,54.28,,12,TRUE,20.4,0
36420,"Oklahoma City, OK Metro Area",1,35.430968,-97.506966,USW00013967,"OKLAHOMA CITY WILL ROGERS AP, OK US",9.68966934,60.68794521,38.8,82.1,38.33,7.4,12,TRUE,43.3,1
36460,"Olean, NY Micro Area",2,42.239099,-78.662332,USC00304808,"LITTLE VALLEY, NY US",12.3942379,45.3890411,22.4,67.2,49.64,,12,TRUE,44.8,0
36500,"Olympia-Lacey-Tumwater, WA Metro Area",1,46.935822,-122.830152,USW00024227,"OLYMPIA AP, WA US",6.941929067,50.57068493,39.6,64.5,51.38,,12,TRUE,24.9,0
36540,"Omaha, NE-IA Metro Area",1,41.290459,-95.99997,USW00014942,"OMAHA EPPLEY AIRFIELD, NE US",8.702269079,52.67205479,24.8,78.5,32.5,26.5,12,TRUE,53.7,1
36620,"Ontario, OR-ID Micro Area",2,43.225869,-117.619933,USC00357310,"ROME 2 NW, OR US",40.88231612,49.13205479,29.2,72.9,8.52,,12,TRUE,43.7,0
36660,"Opelousas, LA Micro Area",2,30.583441,-91.989274,USC00163800,"GRAND COTEAU, LA US",19.10202092,68.64191781,52.5,82,64.6,,12,TRUE,29.5,0
36700,"Orangeburg, SC Micro Area",2,33.436135,-80.802913,USW00053854,"ORANGEBURG MUNI AP, SC US",5.856378379,65.60493151,47.7,82,43.45,,12,TRUE,34.3,0
36740,"Orlando-Kissimmee-Sanford, FL Metro Area",1,28.434396,-81.356084,USW00012815,"ORLANDO INTL AP, FL US",3.039926685,73.53041096,60.8,82.8,48.67,0,12,TRUE,22,0
36780,"Oshkosh-Neenah, WI Metro Area",1,44.085707,-88.668149,USC00476330,"OSHKOSH, WI US",11.40959203,47.01835616,19,73.1,35.98,41,12,TRUE,54.1,1
36820,"Oskaloosa, IA Micro Area",2,41.330797,-92.636366,USC00136327,"OSKALOOSA, IA US",1.355158698,50.35315068,21.7,75.6,42.88,,12,TRUE,53.9,0
36837,"Ottawa, IL Micro Area",2,41.356488,-89.173385,USC00114012,"HENNEPIN, IL US",17.83192024,51.71753425,25,74.7,41.4,,12,TRUE,49.7,0
36830,"Othello, WA Micro Area",2,47.011238,-118.512861,USC00454679,"LIND 3 NE, WA US",4.138009272,51.11232877,32.6,72.6,10.33,,12,TRUE,40,0
36840,"Ottawa, KS Micro Area",2,38.558019,-95.278962,USC00146128,"OTTAWA, KS US",6.149050868,54.62219178,29.6,78.3,40.28,,12,TRUE,48.7,0
36940,"Owatonna, MN Micro Area",2,44.015261,-93.220453,USC00216287,"OWATONNA, MN US",9.188632543,45.1739726,14.3,72.7,36.79,50.1,12,TRUE,58.4,1
37020,"Owosso, MI Micro Area",2,42.951545,-84.146352,USC00206300,"OWOSSO WWTP, MI US",7.682324245,48.14575342,23.9,71.6,36.59,,12,TRUE,47.7,0
37100,"Oxnard-Thousand Oaks-Ventura, CA Metro Area",1,34.358748,-119.133145,USC00046399,"OJAI, CA US",13.15253162,61.00246575,50.6,73.1,16.28,,12,TRUE,22.5,0
37120,"Ozark, AL Micro Area",2,31.430654,-85.609476,USW00013839,"DOTHAN RGNL AP, AL US",19.43357502,68.29726027,51,83,53.11,,12,TRUE,32,0
37140,"Paducah, KY-IL Metro Area",1,37.094234,-88.71705,USW00003816,"PADUCAH, KY US",5.656060455,59.20027397,36.2,79.7,54.41,9.1,12,TRUE,43.5,1
37220,"Pahrump, NV Micro Area",2,37.965864,-116.459011,USW00023153,"TONOPAH, NV US",56.11505856,53.41369863,34.3,76.7,4.48,,12,TRUE,42.4,0
37260,"Palatka, FL Micro Area",2,29.593896,-81.732039,USC00082915,"FEDERAL PT, FL US",25.86676028,71.13287671,56.8,82,51.27,,12,TRUE,25.2,0
37500,"Paragould, AR Micro Area",2,36.120607,-90.566346,USC00035563,"PARAGOULD 1S, AR US",11.46951458,59.93972603,37.4,80.4,55.78,,12,TRUE,43,0
37620,"Parkersburg-Vienna, WV Metro Area",1,39.141531,-81.460402,USW00013867,"PARKERSBURG, WV US",17.61824405,55.47506849,32.3,76.6,45.6,,12,TRUE,44.3,0
37740,"Payson, AZ Micro Area",2,33.789618,-110.81187,USC00027281,"ROOSEVELT 1 S, AZ US",31.61541239,69.8430137,49.5,90.3,14.68,,12,TRUE,40.8,0
37800,"Pella, IA Micro Area",2,41.331433,-93.093868,USW00054902,"DES MOINES 17 E, IA US",29.65628856,49.81479452,22,74.1,40.04,,12,TRUE,52.1,0
37900,"Peoria, IL Metro Area",1,40.788069,-89.514639,USW00014842,"PEORIA GTR PEORIA AP, IL US",19.57469452,53.10164384,26,76.7,41.48,30.1,12,TRUE,50.7,1
37940,"Peru, IN Micro Area",2,40.772883,-86.044258,USC00129138,"WABASH, IN US",18.51203748,51.49890411,25.7,74.6,40.98,,12,TRUE,48.9,0
37980,"Philadelphia-Camden-Wilmington, PA-NJ-DE-MD Metro Area",1,39.894958,-75.311982,USW00013739,"PHILADELPHIA INTL AP, PA US",7.511140741,57.05945205,34.3,79.7,47.62,25.2,12,TRUE,45.4,1
38060,"Phoenix-Mesa-Chandler, AZ Metro Area",1,33.185765,-112.067862,USW00023183,"PHOENIX SKY HARBOR INTL AP, AZ US",27.5616805,76.08986301,56.7,96,6.45,,12,TRUE,39.3,0
38100,"Picayune, MS Micro Area",2,30.774793,-89.586904,USC00227128,"POPLARVILLE EXP STN, MS US",8.346144664,66.48109589,49,81,64.75,,12,TRUE,32,0
38220,"Pine Bluff, AR Micro Area",2,34.121115,-92.041969,USW00093988,"PINE BLUFF GRIDER FLD, AR US",11.54745991,63.29260274,42.9,81.6,52.94,,12,TRUE,38.7,0
38240,"Pinehurst-Southern Pines, NC Metro Area",1,35.308273,-79.492723,USC00311515,"CARTHAGE WTP, NC US",8.23501082,61.26109589,41.6,79.8,48.34,,12,TRUE,38.2,0
38300,"Pittsburgh, PA Metro Area",1,40.471332,-79.863986,USC00360022,"ACMETONIA LOCK 3, PA US",8.295261175,51.45753425,27.7,73.2,47.89,,12,TRUE,45.5,0
38380,"Plainview, TX Micro Area",2,34.066933,-101.571422,USC00417079,"PLAINVIEW, TX US",18.15873886,60.03808219,38.8,80.6,18.84,7.4,12,TRUE,41.8,1
38500,"Plymouth, IN Micro Area",2,41.325003,-86.269036,USC00126989,"PLYMOUTH, IN US",5.793725199,50.4509589,24.8,73.4,41.38,58.9,12,TRUE,48.6,1
38660,"Ponce, PR Metro Area",1,18.022864,-66.645703,RQC00660061,"ADJUNTAS SUBSTN, PR RQ",23.31257294,71.17506849,67.7,73.9,82.05,,12,TRUE,6.2,0
38700,"Pontiac, IL Micro Area",2,40.894376,-88.552852,USC00111475,"CHENOA, IL US",22.02259148,50.79342466,23.7,73.6,40.77,,12,TRUE,49.9,0
38860,"Portland-South Portland, ME Metro Area",1,43.651417,-70.418375,USW00014764,"PORTLAND INTL JETPORT, ME US",9.501836629,48.16465753,25.4,71.2,50.85,71.2,12,TRUE,45.8,1
38900,"Portland-Vancouver-Hillsboro, OR-WA Metro Area",1,45.600622,-122.484378,USC00356750,"PORTLAND WFO, OR US",6.116830199,54.42410959,41,69.8,43.63,5.1,12,TRUE,28.8,1
38920,"Port Lavaca, TX Micro Area",2,28.441719,-96.579574,USC00417140,"PT COMFORT, TX US",24.11064296,71.54219178,54.8,84.6,39.22,,12,TRUE,29.8,0
38940,"Port St. Lucie, FL Metro Area",1,27.228046,-80.425388,USC00088620,"STUART, FL US",18.85138476,75.51726027,64.9,83.5,58.62,,12,TRUE,18.6,0
39020,"Portsmouth, OH Micro Area",2,38.814889,-82.998675,USC00336781,"PORTSMOUTH-SCIOTOVILLE, OH US",11.61617169,55.42438356,32.4,76.2,43.69,,12,TRUE,43.8,0
39300,"Providence-Warwick, RI-MA Metro Area",1,41.70684,-71.286687,USC00377581,"TIVERTON, RI US",10.99260466,52.48712329,30.3,75.7,50.63,36.1,12,TRUE,45.4,1
39340,"Provo-Orem-Lehi, UT Metro Area",1,39.872067,-112.359059,USC00425138,"LITTLE SAHARA REC AREA, UT US",16.76703389,50.12630137,25.4,77.1,12.11,,12,TRUE,51.7,0
39380,"Pueblo, CO Metro Area",1,38.162765,-104.484668,USC00058992,"WFO PUEBLO, CO US",13.3926887,53.49917808,31.8,77.5,13.45,,12,TRUE,45.7,0
39420,"Pullman, WA Micro Area",2,46.905944,-117.53539,USC00457267,"ST JOHN, WA US",21.20880637,49.43561644,32.4,69.7,16.79,29.2,12,TRUE,37.3,1
39460,"Punta Gorda, FL Metro Area",1,26.906396,-82.003657,USC00087397,"PUNTA GORDA 4 ESE, FL US",1.140824743,75.92712329,64.3,84.4,54.04,,12,TRUE,20.1,0
39480,"Putnam, CT Micro Area",2,41.842375,-71.972655,USC00063420,"HAMPTON, CT US",10.66666785,49.20849315,27.9,71,51.47,,12,TRUE,43.1,0
39500,"Quincy, IL-MO Micro Area",2,40.027165,-91.389838,USC00117077,"QUINCY DAM 21, IL US",14.1254048,54.04054795,27.5,77.5,39.82,,12,TRUE,50,0
39540,"Racine-Mount Pleasant, WI Metro Area",1,42.780392,-87.771599,USW00094818,"RACINE BATTEN AP, WI US",4.044186059,48.6860274,23.9,72.7,32.72,,12,TRUE,48.8,0
39580,"Raleigh-Cary, NC Metro Area",1,35.756746,-78.460441,USC00311820,"CLAYTON WTP, NC US",12.89520941,60.41178082,40.8,79.1,52.98,,12,TRUE,38.3,0
39660,"Rapid City, SD Metro Area",1,44.195108,-102.916612,USW00024090,"RAPID CITY RGNL AP, SD US",20.11277019,46.7090411,25.2,73.1,18.46,52.2,12,TRUE,47.9,1
39700,"Raymondville, TX Micro Area",2,26.481861,-97.594731,USC00417184,"PORT MANSFIELD, TX US",18.75636011,73.7030137,58.7,84.1,26.35,,12,TRUE,25.4,0
39740,"Reading, PA Metro Area",1,40.413957,-75.92686,USW00014712,"READING SPAATZ FLD, PA US",6.244754606,54.44575342,31.3,77.1,45.98,,12,TRUE,45.8,0
39780,"Red Bluff, CA Micro Area",2,40.126157,-122.232274,USW00024216,"RED BLUFF MUNI AP, CA US",3.38826089,64.01123288,48.3,82.9,19.03,,12,TRUE,34.6,0
39820,"Redding, CA Metro Area",1,40.760514,-122.043556,USC00048135,"SHASTA DAM, CA US",31.80778362,63.84520548,48.4,83.6,55.55,,12,TRUE,35.2,0
39860,"Red Wing, MN Micro Area",2,44.406178,-92.716,USC00219249,"ZUMBROTA, MN US",12.5396428,44.2230137,14,71.1,35.79,,12,TRUE,57.1,0
39900,"Reno, NV Metro Area",1,40.251057,-119.555507,USC00267953,"SUTCLIFFE, NV US",33.58768319,54.79589041,36.5,77.1,9.06,,12,TRUE,40.6,0
39940,"Rexburg, ID Micro Area",2,44.142753,-111.508107,USC00100470,"ASHTON 1N, ID US",9.003172827,43.63506849,20.7,68.4,23.54,,12,TRUE,47.7,0
39980,"Richmond, IN Micro Area",2,39.863091,-85.006735,USC00127370,"RICHMOND WTR WKS, IN US",11.04776543,52.94958904,28.3,74.6,44.37,,12,TRUE,46.3,0
40080,"Richmond-Berea, KY Micro Area",2,37.59662,-84.205586,USC00151890,"CRAB ORCHARD 6 N, KY US",23.61860748,57.28191781,35.7,75.6,55.01,,12,TRUE,39.9,0
40090,"Rifle, CO Micro Area",2,39.509542,-107.667311,USW00003016,"RIFLE GARFIELD CO AP, CO US",5.404101132,49.52849315,24,74.6,10.06,,12,TRUE,50.6,0
40100,"Rio Grande City-Roma, TX Micro Area",2,26.530903,-98.740235,USC00417622,"RIO GRANDE CITY, TX US",18.54346955,74.73150685,57.7,86.9,26.73,,12,TRUE,29.2,0
40140,"Riverside-San Bernardino-Ontario, CA Metro Area",1,34.538476,-116.134541,USC00044394,"JOHNSON VALLEY, CA US",42.00797319,64.08027397,46.6,84.5,4.26,,12,TRUE,37.9,0
40260,"Roanoke Rapids, NC Micro Area",2,36.320576,-77.542757,USC00314456,"JACKSON, NC US",13.57822366,59.48082192,39.3,78.8,54.54,,12,TRUE,39.5,0
40300,"Rochelle, IL Micro Area",2,42.041884,-89.320176,USC00116897,"POLO 5NW, IL US",23.71832567,49.76438356,22.3,73.5,43.08,,12,TRUE,51.2,0
40340,"Rochester, MN Metro Area",1,43.94981,-92.33066,USW00014925,"ROCHESTER INTL AP, MN US",13.85829949,45.28630137,15.4,71.3,36.06,55.9,12,TRUE,55.9,1
40380,"Rochester, NY Metro Area",1,43.184718,-77.556558,USW00014768,"ROCHESTER GTR INTL AP, NY US",12.33666619,50.04767123,26.9,73.1,35.76,96.2,12,TRUE,46.2,1
40420,"Rockford, IL Metro Area",1,42.331183,-89.042914,USW00094822,"ROCKFORD GTR ROCKFORD AP, IL US",15.93210355,49.82575342,22.4,74.3,39.55,40.8,12,TRUE,51.9,1
40460,"Rockingham, NC Micro Area",2,35.004636,-79.755695,USC00313784,"HAMLET, NC US",14.35367313,63.26465753,43.4,81.6,49.32,,12,TRUE,38.2,0
40580,"Rocky Mount, NC Metro Area",1,35.941045,-77.798549,USC00317400,"ROCKY MT 8 ESE, NC US",11.86774415,60.43150685,40.3,79.3,49.51,,12,TRUE,39,0
40660,"Rome, GA Metro Area",1,34.26369,-85.213685,USC00097600,"ROME, GA US",5.661770526,62.08054795,42.6,79.8,54.57,,12,TRUE,37.2,0
40770,"Russellville, AL Micro Area",2,34.441989,-87.842814,USW00063895,"RUSSELLVILLE 4 SSE, AL US",12.21941807,60.19506849,40.6,77.8,58.69,,12,TRUE,37.2,0
40820,"Ruston, LA Micro Area",2,32.601823,-92.662303,USC00168067,"RUSTON LA TECH, LA US",10.27205174,65.22273973,45.6,82.5,57.88,,12,TRUE,36.9,0
40900,"Sacramento-Roseville-Folsom, CA Metro Area",1,38.790272,-121.005643,USC00043384,"GEORGETOWN RS, CA US",23.80748742,58.21726027,44.8,77.1,51.71,,12,TRUE,32.3,0
40980,"Saginaw, MI Metro Area",1,43.328267,-84.05541,USC00207222,"SAGINAW #3, MI US",12.31023818,48.59068493,23.5,73,35.81,,12,TRUE,49.5,0
41060,"St. Cloud, MN Metro Area",1,45.593031,-94.488363,USC00211691,"COLLEGEVILLE ST JOHN'S, MN US",7.658073175,44.01589041,13.5,72.1,31.08,54,12,TRUE,58.6,1
41140,"St. Joseph, MO-KS Metro Area",1,39.834843,-94.783754,USC00231924,"COSBY 2W, MO US",6.811693123,52.65863014,25.8,77,38.01,,12,TRUE,51.2,0
41180,"St. Louis, MO-IL Metro Area",1,38.740211,-90.345825,USW00013994,"ST LOUIS LAMBERT INTL AP, MO US",2.769357996,57.74794521,32.6,80.6,44.02,17.2,12,TRUE,48,1
41400,"Salem, OH Micro Area",2,40.770073,-80.778455,USC00466442,"NEW CUMBERLAND L/D, WV US",29.96921697,52.32328767,29,73.8,43.44,,12,TRUE,44.8,0
41420,"Salem, OR Metro Area",1,44.903385,-122.901757,USW00024232,"SALEM MCNARY FLD, OR US",7.826132168,54.29726027,42,69.8,39.28,,12,TRUE,27.8,0
41540,"Salisbury, MD Metro Area",1,38.197279,-75.769252,USW00093720,"SALISBURY WICOMICO RGNL AP, MD US",27.65927199,57.5309589,36.8,78.4,46.85,,12,TRUE,41.6,0
41620,"Salt Lake City-Murray, UT Metro Area",1,40.572887,-112.953253,USC00423348,"GRANTSVILLE 2W, UT US",37.77874555,51.36794521,27.2,78.8,11.11,35.9,12,TRUE,51.6,1
41700,"San Antonio-New Braunfels, TX Metro Area",1,29.43306,-98.606973,USC00417947,"SAN ANTONIO INCARNATE WORD, TX US",13.63533649,69.31506849,51.3,84.5,32.26,,12,TRUE,33.2,0
41780,"Sandusky, OH Metro Area",1,41.519606,-82.794568,USW00014846,"SANDUSKY, OH US",10.09843291,52.41068493,29.1,74.8,35.97,,12,TRUE,45.7,0
41820,"Sanford, NC Micro Area",2,35.476336,-79.172117,USC00317656,"SANFORD 8 NE, NC US",13.06403801,61.50438356,42.1,79.8,46.59,,12,TRUE,37.7,0
41860,"San Francisco-Oakland-Fremont, CA Metro Area",1,37.773718,-122.274432,USC00046336,"OAKLAND MUSEUM, CA US",2.877492659,59.95342466,53.1,64.3,19.99,,12,TRUE,11.2,0
41940,"San Jose-Sunnyvale-Santa Clara, CA Metro Area",1,36.908472,-121.371372,USC00044025,"HOLLISTER 2, CA US",8.035416653,58.79452055,49.4,67,13.94,,12,TRUE,17.6,0
41980,"San Juan-Bayamón-Caguas, PR Metro Area",1,18.294453,-66.036844,RQC00669521,"TRUJILLO ALTO 2 SSW, PR RQ",4.338489648,79.23068493,75.7,81.7,76.26,,12,TRUE,6,0
42100,"Santa Cruz-Watsonville, CA Metro Area",1,37.012347,-122.007789,USC00047916,"SANTA CRUZ, CA US",2.829345247,59.12027397,52.3,65.1,25.34,,12,TRUE,12.8,0
42140,"Santa Fe, NM Metro Area",1,35.514531,-105.963972,USC00298088,"SANTA FE SETON, NM US",10.01400019,51.56712329,31,71.8,13.65,29.9,12,TRUE,40.8,1
42340,"Savannah, GA Metro Area",1,32.109153,-81.273107,USW00003822,"SAVANNAH INTL AP, GA US",6.379217468,68.19945205,51.2,83.2,47.34,0.2,12,TRUE,32,1
42460,"Scottsboro, AL Micro Area",2,34.764114,-85.980056,USW00063896,"SCOTTSBORO 2 NE, AL US",7.978673059,60.5060274,40.6,78.3,55.1,,12,TRUE,37.7,0
42620,"Searcy, AR Micro Area",2,35.255118,-91.753034,USC00036506,"SEARCY, AR US",3.58766259,62.03753425,39.2,83,56.37,2.6,12,TRUE,43.8,1
42660,"Seattle-Tacoma-Bellevue, WA Metro Area",1,47.490552,-121.833977,USC00451233,"CEDAR LAKE, WA US",10.29516211,46.58082192,35.9,60.6,104.45,51.7,12,TRUE,24.7,1
42680,"Sebastian-Vero Beach-West Vero Corridor, FL Metro Area",1,27.700528,-80.574789,USC00089219,"VERO BEACH 4SE, FL US",17.72004073,73.65232877,62.5,81.8,54.79,,12,TRUE,19.3,0
42780,"Selinsgrove, PA Micro Area",2,40.755412,-77.07302,USC00367931,"SELINSGROVE 2 S, PA US",18.06026428,51.19972603,27.7,74.3,43.27,23.9,12,TRUE,46.6,1
42820,"Selma, AL Micro Area",2,32.333526,-87.11436,USC00017366,"SELMA, AL US",12.74883718,66.37342466,47.5,82.8,54.95,,12,TRUE,35.3,0
42860,"Seneca, SC Micro Area",2,34.748766,-83.06154,USC00388887,"WALHALLA, SC US",1.380104684,59.80630137,40.3,78.1,61.23,,12,TRUE,37.8,0
42900,"Seneca Falls, NY Micro Area",2,42.782294,-76.827088,USC00300331,"AURORA RSCH FARM, NY US",14.72523881,48.1030137,24.6,70.9,37.8,,12,TRUE,46.3,0
42940,"Sevierville, TN Micro Area",2,35.787822,-83.5249,USC00403420,"GATLINBURG 2 SW, TN US",11.1772233,55.90410959,36.6,72.9,58.36,8.4,12,TRUE,36.3,1
42980,"Seymour, IN Micro Area",2,38.911957,-86.042516,USC00121747,"COLUMBUS, IN US",30.09155782,54.42027397,30.5,75.5,49.69,14,12,TRUE,45,1
43020,"Shawano, WI Micro Area",2,44.851643,-88.745543,USC00477708,"SHAWANO 2SSW, WI US",14.06065123,44.35945205,16.2,70.6,34.6,52.5,12,TRUE,54.4,1
43060,"Shawnee, OK Micro Area",2,35.211391,-96.957004,USC00348042,"SEMINOLE, OK US",27.698349,61.7290411,39.6,82.9,45.21,,12,TRUE,43.3,0
43140,"Shelby-Kings Mountain, NC Micro Area",2,35.33463,-81.557114,USC00317845,"SHELBY 2 NW, NC US",2.896096442,59.64876712,39.5,78.4,47.41,,12,TRUE,38.9,0
43180,"Shelbyville, TN Micro Area",2,35.51366,-86.458294,USC00408246,"SHELBYVILLE WATER DEPT, TN US",2.95242351,60.39561644,39,79.1,58.44,,12,TRUE,40.1,0
43220,"Shelton, WA Micro Area",2,47.350832,-123.173103,USC00451939,"CUSHMAN POWERHOUSE #2, WA US",2.409503146,51.20931507,40.4,64.9,91.54,,12,TRUE,24.5,0
43300,"Sherman-Denison, TX Metro Area",1,33.624548,-96.675777,USC00418274,"SHERMAN, TX US",9.301179801,63.94493151,43.2,83.1,45.91,,12,TRUE,39.9,0
43340,"Shreveport-Bossier City, LA Metro Area",1,32.437682,-93.744884,USC00168444,"SHREVEPORT STHRN HILLS, LA US",6.080114985,65.10356164,45.3,82.8,54.24,1,12,TRUE,37.5,1
43380,"Sidney, OH Micro Area",2,40.33668,-84.204142,USC00337693,"SIDNEY 1 S, OH US",8.6285041,51.34465753,26.5,73.3,43.68,,12,TRUE,46.8,0
43460,"Sikeston, MO Micro Area",2,36.94283,-89.427601,USC00237772,"SIKESTON PWR STN, MO US",18.83859662,59.87972603,36.4,80.8,56.22,,12,TRUE,44.4,0
43580,"Sioux City, IA-NE-SD Metro Area",1,42.508037,-96.311314,USC00137702,"SIOUX CITY ANG, IA US",13.55910558,48.30191781,19.3,75,31.85,,12,TRUE,55.7,0
43640,"Slidell-Mandeville-Covington, LA Metro Area",1,30.410022,-89.951962,USW00053865,"SLIDELL AP, LA US",14.49133809,68.37616438,51.6,82.4,57.55,,12,TRUE,30.8,0
43740,"Somerset, PA Micro Area",2,39.981297,-79.028486,USC00363928,"HIDDEN VALLEY, PA US",20.57111082,47.56821918,24.3,69.6,58.45,,12,TRUE,45.3,0
43780,"South Bend-Mishawaka, IN-MI Metro Area",1,41.774981,-86.123014,USC00128437,"S BEND, IN US",13.30373742,50.24465753,25,73.4,43.19,,12,TRUE,48.4,0
43890,"Sparta, WI Micro Area",2,43.945175,-90.619969,USC00477997,"SPARTA, WI US",15.75784202,44.81835616,15.5,71.7,37.1,,12,TRUE,56.2,0
43900,"Spartanburg, SC Metro Area",1,34.83462,-81.842401,USC00388188,"SPARTANBURG 3 SSE, SC US",10.42887481,61.80794521,42.8,79.5,49.87,,12,TRUE,36.7,0
43940,"Spearfish, SD Micro Area",2,44.348514,-103.806362,USC00394834,"LEAD, SD US",5.080357375,46.44712329,28.2,70,32.28,165.7,12,TRUE,41.8,1
43980,"Spencer, IA Micro Area",2,43.081224,-95.149875,USC00137844,"SPENCER 1 N, IA US",9.352388126,46.51753425,16.8,73.6,33.24,48.8,12,TRUE,56.8,1
44020,"Spirit Lake, IA Micro Area",2,43.389611,-95.196057,USC00135493,"MILFORD 4 NW, IA US",1.221333421,46.3509589,16.6,73.2,29.51,42.7,12,TRUE,56.6,1
44060,"Spokane-Spokane Valley, WA Metro Area",1,48.091618,-117.663472,USC00451395,"CHEWELAH, WA US",20.9998898,46.50410959,26.4,68,20.62,,12,TRUE,41.6,0
44100,"Springfield, IL Metro Area",1,39.828621,-89.696067,USW00093822,"SPRINGFIELD CAPITAL AP, IL US",2.067811961,54.46931507,28.5,76.8,41.04,25,12,TRUE,48.3,1
